{
  "schemaVersion": "1.0",
  "jobId": "demo-school-2026-2027",
  "schoolId": "00000000-0000-0000-0000-000000000001",
  "timeSlots": [
    { "id": "00000000-0000-0000-0000-000000000601", "day": 1, "period": 1 },
    { "id": "00000000-0000-0000-0000-000000000602", "day": 1, "period": 2 },
    { "id": "00000000-0000-0000-0000-000000000603", "day": 2, "period": 1 },
    { "id": "00000000-0000-0000-0000-000000000604", "day": 2, "period": 2 }
  ],
  "lessons": [
    {
      "id": "00000000-0000-0000-0000-000000000701",
      "classId": "00000000-0000-0000-0000-000000000201",
      "subjectId": "00000000-0000-0000-0000-000000000401",
      "teacherId": "00000000-0000-0000-0000-000000000301",
      "requiredSessions": 2
    },
    {
      "id": "00000000-0000-0000-0000-000000000702",
      "classId": "00000000-0000-0000-0000-000000000201",
      "subjectId": "00000000-0000-0000-0000-000000000403",
      "teacherId": "00000000-0000-0000-0000-000000000302",
      "requiredSessions": 1
    },
    {
      "id": "00000000-0000-0000-0000-000000000703",
      "classId": "00000000-0000-0000-0000-000000000202",
      "subjectId": "00000000-0000-0000-0000-000000000402",
      "teacherId": "00000000-0000-0000-0000-000000000301",
      "requiredSessions": 1
    },
    {
      "id": "00000000-0000-0000-0000-000000000704",
      "classId": "00000000-0000-0000-0000-000000000202",
      "subjectId": "00000000-0000-0000-0000-000000000401",
      "teacherId": "00000000-0000-0000-0000-000000000301",
      "requiredSessions": 1
    }
  ]
}

